{"schema":"ingen.mutation-plan/v1","status":"ready","catalogue":{"path":"fixtures/catalogue.yaml","id":"typescript-provider-conformance","version":1,"sha256":"aaaaaaaaaaaaaaaaaaaaaaaaaaaaaaaaaaaaaaaaaaaaaaaaaaaaaaaaaaaaaaaa"},"contract":{"id":"provider-conformance","version":1,"sha256":"bbbbbbbbbbbbbbbbbbbbbbbbbbbbbbbbbbbbbbbbbbbbbbbbbbbbbbbbbbbbbbbb"},"oracle":{"schema":"ingen.oracle/v1","sha256":"cccccccccccccccccccccccccccccccccccccccccccccccccccccccccccccccc"},"baseline":{"evidence_path":".artifacts/conformance-baseline","run_id":"baseline-conformance","contract":{"id":"provider-conformance","version":1,"sha256":"bbbbbbbbbbbbbbbbbbbbbbbbbbbbbbbbbbbbbbbbbbbbbbbbbbbbbbbbbbbbbbbb"},"oracle":{"schema":"ingen.oracle/v1","sha256":"cccccccccccccccccccccccccccccccccccccccccccccccccccccccccccccccc"}},"oracle_policy_sha256":"dddddddddddddddddddddddddddddddddddddddddddddddddddddddddddddddd","mutations":[{"sequence":1,"spec":{"id":"status-200-create","plane":"implementation","operator":"response.status.replace","target":"POST /documents","description":"Change accepted status","change":{"from":202,"to":200},"expected_rule_ids":["rule-accepted"],"status":"candidate"}},{"sequence":2,"spec":{"id":"remove-name-create","plane":"implementation","operator":"response.field.remove","target":"POST /documents","description":"Remove required name","change":{"field":"name"},"expected_rule_ids":["rule-created"],"status":"candidate"}}]}
